{
  "v": 1,
  "type": "hello",
  "id": "0c6d1f0a-9a3e-4d55-8f37-6b3c2f4e1a01",
  "body": {
    "agent_version": "0.1.0",
    "host_name": "PC-EXAMPLE-01",
    "os_name": "Windows 11 Pro 24H2",
    "os_version": "11 (26100)",
    "ips": [
      "192.0.2.10"
    ],
    "boot_time": 1791244800,
    "agent_time": "2026-10-06T08:00:00.120Z",
    "hw_fingerprint": "b1946ac92492d2347c6235b4d2611184e1c4b6d4a1f0e8f3c2b7a69d5e4f3021"
  }
}
