{
  "v": 1,
  "type": "command",
  "id": "6c1d9e2f-3a4b-4c5d-8e6f-7a8b9c0d1e22",
  "body": {
    "command_id": "6c1d9e2f-3a4b-4c5d-8e6f-7a8b9c0d1e22",
    "kind": "software.uninstall",
    "params": {
      "package_id": "4f3e2d1c-0b9a-4876-9543-210fedcba987",
      "name": "7-Zip",
      "version": "24.09",
      "installer_type": "msi",
      "uninstall_args": "",
      "detect": { "type": "display_name", "value": "7-Zip%" },
      "timeout_sec": 1800
    },
    "expires_at": "2026-10-21T08:00:00.000Z",
    "issued_by": "S000001",
    "issued_at": "2026-10-20T08:00:00.000Z"
  }
}
