{
  "v": 1,
  "type": "command",
  "id": "6c1d9e2f-3a4b-4c5d-8e6f-7a8b9c0d1e21",
  "body": {
    "command_id": "6c1d9e2f-3a4b-4c5d-8e6f-7a8b9c0d1e21",
    "kind": "software.install",
    "params": {
      "package_id": "4f3e2d1c-0b9a-4876-9543-210fedcba987",
      "name": "7-Zip",
      "version": "24.09",
      "url": "/agent/v1/packages/4f3e2d1c-0b9a-4876-9543-210fedcba987",
      "sha256": "9b1d2c3a4f5e6d7c8b9a0f1e2d3c4b5a69788796a5b4c3d2e1f0a9b8c7d6e5f4",
      "size_bytes": 1572864,
      "installer_type": "msi",
      "install_args": "ALLUSERS=1",
      "signer_thumbprints": ["b1c2d3e4f5a60718293a4b5c6d7e8f9012345678"],
      "detect": { "type": "display_name", "value": "7-Zip%" },
      "timeout_sec": 1800,
      "reboot_policy": "never"
    },
    "expires_at": "2026-10-21T08:00:00.000Z",
    "issued_by": "S000001",
    "issued_at": "2026-10-20T08:00:00.000Z"
  }
}
