{
  "v": 1,
  "type": "replace_watchdog",
  "id": "7d3f9b2a-5c4e-4f60-8b1c-2d3e4f5a6b72",
  "body": {
    "version": "0.3.1",
    "path": "C:\\ProgramData\\GigaNexus\\Agent\\cache\\watchdog\\0.3.1\\rustit-watchdog.exe",
    "sha256": "0123456789abcdef0123456789abcdef0123456789abcdef0123456789abcdef",
    "signer_thumbprints": [
      "a1b2c3d4e5f60718293a4b5c6d7e8f9012345678"
    ]
  }
}
