{
  "v": 1,
  "type": "command",
  "id": "6c1d9e2f-3a4b-4c5d-8e6f-7a8b9c0d1e23",
  "body": {
    "command_id": "6c1d9e2f-3a4b-4c5d-8e6f-7a8b9c0d1e23",
    "kind": "system.reboot",
    "params": { "delay_sec": 300, "message": "安裝更新後需重新開機", "force": false },
    "expires_at": "2026-10-20T12:00:00.000Z",
    "issued_by": "S000001",
    "issued_at": "2026-10-20T08:00:00.000Z"
  }
}
