{
  "v": 1,
  "type": "command",
  "id": "6c1d9e2f-3a4b-4c5d-8e6f-7a8b9c0d1e24",
  "body": {
    "command_id": "6c1d9e2f-3a4b-4c5d-8e6f-7a8b9c0d1e24",
    "kind": "system.reboot.cancel",
    "params": {},
    "expires_at": "2026-10-20T09:00:00.000Z",
    "issued_by": "S000001",
    "issued_at": "2026-10-20T08:01:00.000Z"
  }
}
